{
  "$schema": "https://json-schema.org/draft/2020-12/schema",
  "$id": "metaagent/checkpoints/3.0.0",
  "title": "MetaAgent Checkpoints",
  "description": "Schema for .agent/checkpoints.json — session state",
  "type": "object",
  "properties": {
    "metaagent_version": {
      "type": "string",
      "description": "MetaAgent version that created this checkpoint",
      "pattern": "^[0-9]+\\.[0-9]+\\.[0-9]+$"
    },
    "session_id": {
      "type": "string",
      "description": "Unique session identifier"
    },
    "target_repo": {
      "type": "string",
      "description": "Path to the target repository"
    },
    "goal": {
      "type": ["string", "null"],
      "description": "Session goal (set by user, may be null until first task)"
    },
    "project_type": {
      "type": ["string", "null"],
      "enum": [null, "existing", "greenfield", "scaffold"],
      "description": "Type of the target project (set in ANALYSE phase)"
    },
    "phases": {
      "type": "object",
      "properties": {
        "init":         { "type": "string", "enum": ["pending", "in_progress", "completed", "failed", "skipped"] },
        "analyse":      { "type": "string", "enum": ["pending", "in_progress", "completed", "failed", "skipped"] },
        "roadmap":      { "type": "string", "enum": ["pending", "in_progress", "completed", "failed", "skipped"] },
        "design":       { "type": "string", "enum": ["pending", "in_progress", "completed", "failed", "skipped"] },
        "decomposition": { "type": "string", "enum": ["pending", "in_progress", "completed", "failed", "skipped"] },
        "execution":    { "type": "string", "enum": ["pending", "in_progress", "completed", "failed", "skipped"] },
        "metastate":    { "type": "string", "enum": ["pending", "in_progress", "completed", "failed", "skipped"] },
        "handoff":      { "type": "string", "enum": ["pending", "in_progress", "completed", "failed", "skipped"] }
      },
      "additionalProperties": false
    },
    "tasks": {
      "type": "array",
      "description": "List of tasks (one-liners after archiving)",
      "items": {
        "type": "object",
        "properties": {
          "id":     { "type": "string" },
          "title":  { "type": "string" },
          "status": { "type": "string", "enum": ["pending", "in_progress", "completed", "failed", "archived"] }
        },
        "required": ["id", "title", "status"],
        "additionalProperties": false
      }
    },
    "last_updated": {
      "type": "string",
      "format": "date-time",
      "description": "ISO 8601 timestamp of last update"
    }
  },
  "required": ["metaagent_version", "session_id", "phases", "last_updated"],
  "additionalProperties": false
}
